title,abstract,keyphrases
SMM expert for high ROIs -- 2,"We need an absolute expert on SMM to achieve our aggressive growth figures. Need fb and insta masters who have refined experiences of not less than 5-6 years and are confident enough to achieve ROI of 4 right from day one. The job involves evaluating the current creatives and suggest changes also. We have an internal team of video editors, photo editors and graphic artist. We have audiences sorted out but we need fast and efficient execution the project is high pressure but also offers high rewards. Message for more details. The below budgets are not indicative, this will be paid once our ROI targets are achieved. The payouts can happen every week/every day if the targets are met. We can fix an amount to get started incase the targets are still not paid the payouts can still take place","aggressive growth figures, smm expert, absolute expert, high rois, roi targets, high pressure, high rewards, video editors, photo editors, current creatives"
Client search and direct mail for plant / weed / cannabis accessories,"THE PRODUCT: Easy-Rolls 2.0 is a patented - and made in Italy - light hanger that allows to easily adjust the height of your lights/reflector. Easy-Rolls can hold up to 5Kg so, with 2 Easy-Rolls, it's possible to hold lamps up to 10kg. THE MARKET: Easy-Rolls 2.0 can be used to adjust lamp's height to grow plants, weed and flowers, but also stock. THE JOB: We need to expand our market base and we are looking for a freelancer to prepare: A) a list of at least 300 customers who are trading weed accessories. 150 customers should be in Europe and 150 should be in USA. Preference would be for wholesalers, but retailers would also be fine. Our aim is to find customers who can retail or wholesale Easy-Rolls 2.0 EPERIENCE IN GENERATING LEADS IN WEED AND CANNABIS MARKET is highly valued...","client search, light hanger, direct mail, easy-rolls, weed accessories, cannabis market, product, italy, market base, plant"
Animated Short Film (8Min),Would like help introducing my short animated film. I am considering it being in 3-D using autodesk Maya but open to 2D if the artist commits to the project. I would prefer a flat rate to pay you during the course of the work. More details on project once someone agrees to help.,"animated short film, film, flat rate, project, maya, artist, course, work, more details, 2d"
Teach me facebook ad manager and/or google adwords,"Hello, I have just started an online marketing agency. I am looking to bring somebody into my team to work with me long term. I need you to teach me how to run facebook and google ads. I have a client we can work with.","online marketing agency, google adwords, google ads, long term, facebook, team, client, ad manager"
Bootstrap5 Extension for Yii1,We need a bootstrap5 extension for Yii1. We are going to upgrade bootstrap2 to 5. As a software developer team we are going to assist your development and guide. Our team has knowledge and experience to the this work. We need to have more resource.,"bootstrap5 extension, software developer team, yii1, bootstrap2, team, development, guide, knowledge, experience, work"
NEXTION+ARDUINO Expert needed for an ongoing project.,"Hello there! I need someone to help me with a Nextion+Arduino project that I am working on. What I want you to do is to check the files that I have already made using Nextion Editor and Arduino to talk to each other. I'd like you to check them, improve them in terms of looks, operation and help me with what's undone. Basic idea is we have a display and Arduino and we want them to talk to each other all time and make the changes on Arduino side, I also have an I2C based battery fuel gauge IC so I'd like you to help me to track it's SOC as well. If you are someone who has worked with Nextion Displays and can do this, kindly bid. I'd prefer it if you have the display at your end and can test the firmware on Arduino and test the HMI interface on the display parallel...","nextion+arduino expert, ongoing project, nextion editor, nextion displays, arduino, display parallel, hmi interface, battery fuel gauge ic, basic idea, i2c"
Tableau/PowerBI + Blockchain,"Hi, I am looking for developer with experience of Tableau or PowerBI implementation. Xero, Blockchain experience would be a plus. More details through chat.","powerbi implementation, blockchain experience, tableau, developer, xero, chat, plus, more details, blockchain hi"
Social Media Manager  -- 2,Create a presence on TikTok and Instagram platforms to engage audience and attract new clients,"social media manager, instagram platforms, new clients, tiktok, presence, audience"
Social Media Manager,Create a presence on TikTok and Instagram platforms to engage audience and attract new clients,"social media manager, instagram platforms, new clients, tiktok, presence, audience"
Ad exchange scripts,I need to develop RTB header bidding Ads script. Run multiple ads network to provide our publishers high revenue.,"multiple ads network, rtb header, ads script, high revenue, ad exchange scripts, publishers"
Gear System Developer,"I am looking for someone who can develop a gear system as per my requirements. I will be sharing a basic problem statement according to that gear system need to be developed. Final result will be in cad model and .STL file formate. This job will involve Rack Gear, bevel gear (or similar), Spur Gears ......","gear system developer, basic problem statement, rack gear, bevel gear, spur gears, cad model, file formate, requirements, final result, job"
ONLINE DROPSHIPPING (SHOPIFY & AMAZON) STORES EXPERT,I am looking for someone who can help build our online dropshipping stores. We will discuss details later after...,"online dropshipping stores, stores expert, shopify, amazon, details"
Private project or contest #35337870,Empty String,"private project, empty string"
Website and App Building (iOS+Android) Development,We've an idea related to Tech and need a Tech Partner for further execution of the idea. The role will mainly include- Development of Website and Application (iOS+Android) and managing it with complete responsibility. Preferred are the people with good experience in this field. Interested people can reach out. Things are negotiable at our end.,"tech partner, app building, idea, development, website, complete responsibility, ios+android, interested people, good experience, application"
old german handwriting reading,Looking for someone able to read old german handwriting on letters and postcards and re-write them in modern german. I have a number of letters and postcards from my family and am unable to read them. Emclosed is a sample.,"old german handwriting reading, modern german, letters, postcards, number, family, sample"
install chat with voice and text option,install chat with voice and text option,"text option install, voice, chat"
Create HR documents for my company.,"Hello, Hope you are doing well. I have registered a company and for new employee I need the HR documentation to be done. Bid only if you have already created such documents.","company, new employee, hope, hr documentation, hr documents, such documents"
Need a professional Video Editor in LOW BUDGET.,Budget is just 30 INR per min. You need to create the video from the voice over. All videos must be 4K . Only apply if you can do this in this Budget.,"professional video editor, low budget, video, inr, min, voice, k"
Looking for hacker to HACK A WHATSAPP PLUS,"I don't have much things to say... I just need to hack one WHATSAPP PLUS, I know the person, and the person has WHATSAPP PLUS. I want to have access to their messeges and calls. is it posible?","whatsapp plus, person, hack, hacker, access, messeges, calls, much things"
YouTube Video Editing,"I need someone who can creatively edit videos, to add the relevant and engaging pics and small vids to my YT video. I need someone for an ongoing project who will be able to join my team, someone with a great experience and most importantly to be creative and engage the viewer to watch the vid till the end.","youtube video editing, small vids, engaging pics, great experience, ongoing project, videos, team, viewer, vid, end"
Write de words de la English,Writing words in English Proofread them also mama type them,"english writing words, english proofread, mama, words de"
"On ground research | Photos, Videos and Notes of a specific site in Bahrain","Need someone to spend time at a specific site in A'Ali, Bahrain and take good quality pictures, videos and detailed notes of roads, offices, residential projects and roads/infrastructure in a 15 minute radius of the site. The purpose of this exercise is to evaluate the level of commercial and residential development, as well as upcoming projects/ongoing construction projects.","good quality pictures, specific site, ground research | photos, detailed notes, minute radius, ongoing construction projects, residential projects, residential development, bahrain, videos"
Customize a website,Customize my WordPress homepage to my satisfactory sample,"wordpress homepage, satisfactory sample, website"
I will create and fix any excel formula and macros work for you,"Welcome to my Gig! EXCEL SPREADSHEETS | FORMULAS | FUNCTIONS | MACROS | FIXING ERRORS I can help you in any kind of tasks as follows: VLOOKUP/HLOOKUP INDEX-MATCH IF/SUMIF/SUMIFS/IFERROR/SUMPRODUCT COUNTIF/COUNTIFS DROP DOWN & DATA VALIDATION CONDITIONAL FORMATTING REMOVING DUPLICATES Formula Automation/Linking Fixing up #DIV/0, #N/A, #NAME?, #NULL!, #NUM!, #REF!, AND #VALUE! Error in Excel Sheet. Splitting the text/data/Formula into different cells Formula related any issues as per your requirements. I Will Create Excel Spreadsheet with Formula or Macro and Fix Error to Improve Your Current Spreadsheets Based on Your Requirements. Please Contact Me and I'll Help You Out. Note: Feel free to details discussion before placing an order so that I can provide you profess...","excel spreadsheets | formulas | functions | macros |, duplicates formula automation, data validation conditional, hlookup index-match, sumproduct countif, excel formula, different cells formula, gig, excel sheet, excel spreadsheet"
YouTube Video voice over and commentary,"I need someone to do voice over to my YT channel, somebody who is creative and will be able to engage my viewers till the end of the video, do not be monotonic, someone who loves what he does, I will need to work with one person for an ongoing project, he will not be changed later on. NOT PROMOTIONAL VIDS. NO TEXT TO SPEECH WEBSITES.","youtube video voice, ongoing project, promotional vids, video, voice, commentary, viewers, end, person, text"
Vue + Laravel specialist needed for fix couple issues,"My project is nearly done but I have issue with cookies in vue and couple small tasks, I need someone with ecommerce experience on vue and laravel. This is fully custom project and I need only back-end development. Only experts please with examples with above technologies. Preferred single freelancer and potential long-term project work","fix couple issues, vue + laravel specialist, ecommerce experience, potential long-term project work, small tasks, custom project, vue, back-end development, laravel, preferred single freelancer"
Acticle writer,Hi I can write you any type of acticle as long as you give me the keyword of it.,"acticle writer, type, keyword"
Manage Sales of Digitac.com,We are in search of a freelancer who will be responsible to handle sales for Digitac. • Lead conversation. • Generate new leads. • Develop and execute strategies to drive business from new and existing clients. • Maintain clients record.,"sales, lead conversation, digitac.com, search, freelancer, new leads, clients record, existing clients, strategies, business"
Create a world document based on a sample,Create a world document based on a sample. The same contents (copy everything) but changes to the headings and footers. Urgent and the document is required within 24 hours.,"world document, sample, changes, headings, footers, urgent, hours, same contents"
modul firebase_core not found IOS flutter build ipa error,modul firebase_core not found IOS flutter build ipa error,"build ipa error modul firebase_core, modul firebase_core"
CONTENT WRITING,am in need of content writer who is good at conducting through research on Industry,"content writer, industry, need, research"
CONTENT WRITTER,We are an end-line packaging solution providerWe deal in various packaging products with dealers and retailers. We will be needing good professional content.,"end-line packaging solution providerwe deal, good professional content, various packaging products, dealers, retailers, content"
"Redraw of a ""triumph of death"" detail","For a tattoo project, I need to redraw a Bruegel ""Triumph of the Death"" detail, the Skeleton-clock you can see attached! The redraw have to be true to the original, but also match as possibile the drawing style of other two images attached here. I don't need an HQ image: just a monochrome outline it's sufficient. Thre key of the job is to reply the image and the Bruegel flavour (that is especially in the skeleton posture), but also matching the reference styles... Iknow, it's not easy! The skeleton have to be as the Bruegel one, but you can play with line thickness to match the reference. About the clock, probrably you can focus on reference style playing with quadrant' stripes ... here you have a lot of liberty (also 'cause on the bruegel paint this str...","tattoo project, triumph, death, detail, bruegel flavour, skeleton-clock, bruegel paint, redraw, reference style, monochrome outline"
"I will Fix Google Sheets, Microsoft Excel for you.","Welcome. [EXCEL SPREADSHEETS | FORMULAS | FUNCTIONS | FIXING ERRORS ] I can help you in any kind of tasks as follows: INDEX-MATCH IF/SUMIF/SUMIFS/IFERROR/SUMPRODUCT COUNTIF/COUNTIFS DROP DOWN & DATA VALIDATION CONDITIONAL FORMATTING REMOVING DUPLICATES Formula Automation/Linking Fixing up #DIV/0, #N/A, #NAME?, #NULL!, #NUM!, #REF!, AND #VALUE! Error in Excel Sheet. Splitting the text/data/Formula into different cells Formula related any issues as per your requirements. I Will Create Excel Spreadsheet with Formula or Macro and Fix Error to Improve Your Current Spreadsheets Based on Your Requirements. Please Contact Me and I'll Help You Out. Thank You!","google sheets, duplicates formula automation, microsoft excel, data validation conditional, excel spreadsheets | formulas | functions |, sumproduct countif, excel sheet, excel spreadsheet, different cells formula, fix error"
ETL adventureworks sample data base movement,"Adventure works data movement from on Prem SQL server to S3 or snowflake using Apache nifi, talend or other etl tool Kafka etc","etl adventureworks sample data base movement adventure, prem sql server, other etl tool kafka, data movement, apache nifi, snowflake, s3"
We need a Singer-Songwriter to make a creepy horror song for our Short Film.,"Hello! We are a group of young spanish film students about to graduate. We are looking for young songwriters and singers who want to participate in our final project. It consists of a short horror film, and we want there to be an original song that will be hummed during the film and, in the final credits, the whole song will be played. Everything will be under contract, agreed and discussed. Whenever the song is used, the author will be named and his name will also appear on the posters. Credit will always be given to the author. As it is a university work, the budget we have is very limited. So the remuneration will depend on what we manage to raise (but there will be a payment for the work). But even if the payment is low, the project will be distributed internationally at film festivals...","creepy horror song, young spanish film students, short horror film, singer-songwriter, film festivals, young songwriters, original song, final project, final credits, university work"
A Telegram Software -- 2,I need a software to create and add members in telegram channels. The application must have the following features: 1. Creation of a number of virtual numbers (ex 2 million members). 2. Registration of these numbers in Telegram. 3. Join them to the specified channels (without any limitation on the number of channels).,"telegram software, telegram channels, members, virtual numbers, number, specified channels, application, features, creation, registration"
Newsletter Editorial Writer with focus on City/Community Building,"About the role: We are looking for a creative Newsletter Editorial Writer to help grow our EngagingCities newsletter, In this role you'll own the process of sourcing, editing and publishing stories for our website and bi-weekly newsletter. The ideal fit for this role is a strong creative writer with a passion for storytelling around city- or community building-related topics and collaborative decision-making.","creative newsletter editorial writer, engagingcities newsletter, strong creative writer, bi-weekly newsletter, community building, ideal fit, collaborative decision-making, role, building-related topics, city"
Android APP design at http://appinventor.mit.edu/,"APP is done and working ok, we just need someone to make the design better. the APP was done at i have all codes. I tried to do it myself but for not having experience on it. App Bars are not in good shape , also not in the right color, Bellow is what i need 1 - APP logo and logo fixed to better design 2 - set colors at the Bars 3 - change some words to portuguese ( i will provide it) 4 - organize the Bars 5 - organize the text at the end of App attached you can see instructions + APp. also attached a picture of how it should be looking at the end, or you can make it better appearance","android app design, http://appinventor.mit.edu/ app, app bars, app logo, right color, better appearance, good shape, end, design, codes"
Online bookshop with custom payment API integration,"We're looking to hire someone who can build a straightforward onlie shop using Magento, and do the API integration of our payment processing partner. We will be selling books and merchandise. Some specificities include: 1. Two-language option; 2. Four categories: Coming soon/Preorder now! - Books - DVD/Audiobooks - Merchandise/Gifts; 3. Search option; 4. Shopping cart; 5. Option to sign up to receive newsletter. We attach a few examples of website fronts which we like.","custom payment api integration, payment processing partner, straightforward onlie shop, online bookshop, magento, two-language option, merchandise, search option, books, shopping cart"
Comic line drawing illustrations -- 2,"I need someone, who are good in line drawing inking comic book illustrations","comic line drawing illustrations, comic book illustrations, line"
Data Entry,"Making a comprehensive data in set format from visiting cards, Visitor book, dispatch slips, product codes etc","data entry, visitor book, comprehensive data, set format, dispatch slips, product codes, cards"
Comic line drawing illustrations,I am looking someone who can make me Comic line drawing Art for colouring.,"comic line drawing illustrations, art"
Online Music Raters -,We are looking for individuals who want to earn everyday by rating music. Please bid or message us.,"online music raters, music, individuals"
Mobile app testing for Middle East citizens,"For our app development we are looking for applicants testing face recognition. Requirements: you have a passport and/or an ID card, a smartphone, and a webcam to deliver 10 photos. All backgrounds must be different, also your clothing and face expression. Full instructions will send to you, after applying. Apply in English only! If you like do do this task, we reward you with 8 USD per set. Ask your friends to join, so they can also earn some money. Who can join: all from 18 years and older, man and women (cover/hijab is allowed). To be sure you read fully, mention: WELLKNOWN in your response.","applicants testing face recognition, middle east citizens, mobile app testing, app development, face expression, requirements, passport, smartphone, webcam, photos"
Google analytics,I need Google analytics Expret Only Indian student's,"google analytics expret, indian student"
Image editing / Graphics designing,"I am planning to start my own graphics designing firm, I need graphic designers who are used to all the industry level software, and work in fast and efficient way.","industry level software, own graphics designing firm, efficient way, graphic designers, image editing"
Build a speed dating conference dating website. Faster way of dating -- 2,We are looking for an individual to create a speed dating conference website. For example an individual is enters and pays for the 7 o’clock session where they are entered into a conference with 20 people - 10 girls and 10 boys. We will enter a deadline and time for when the conference will start. Each boy and girl gets 5 mins to talk to each other before they move to the next candidate over a webcam. We as admin can remove anyone from the conference if any rules are broken. We are looking for a professional coder and preferably someone business minded. We will roll this model out in the U.K. please apply if you want to help us change the dating industry and speed up dating rather than liking someone profile and not having time to reply to one another. This is instant dating. P...,"conference website, faster way, speed, o’clock session, instant dating, individual, time, professional coder, example, enters"
Daily Cash Flow,I need a proven procedure to get daily income of $1000 from the net with investment of $100 only.,"daily cash flow, daily income, procedure, net, investment"
I need visual portfolio plugin expert.,"I have a custom Worpdress theme and there is a small style bug on the homepage, i cant get the posts to show in poster layout, the theme is completely designed just needs settings changed to make it work.","visual portfolio plugin expert, small style bug, worpdress theme, poster layout, custom, homepage, posts, settings"
Core PHP Small Task,I have a PHP Project and I want to load data based on certain conditions (like $_POST or $_GET) and also i want clean code.,"core php small task, php project, clean code, certain conditions, post, data, get"
I will create and fix any excel formula and macros work for you,"Welcome to my Gig! EXCEL SPREADSHEETS | FORMULAS | FUNCTIONS | MACROS | FIXING ERRORS I can help you in any kind of tasks as follows: VLOOKUP/HLOOKUP INDEX-MATCH IF/SUMIF/SUMIFS/IFERROR/SUMPRODUCT COUNTIF/COUNTIFS DROP DOWN & DATA VALIDATION CONDITIONAL FORMATTING REMOVING DUPLICATES Formula Automation/Linking Fixing up #DIV/0, #N/A, #NAME?, #NULL!, #NUM!, #REF!, AND #VALUE! Error in Excel Sheet. Splitting the text/data/Formula into different cells Formula related any issues as per your requirements. I Will Create Excel Spreadsheet with Formula or Macro and Fix Error to Improve Your Current Spreadsheets Based on Your Requirements. Please Contact Me and I'll Help You Out. Note: Feel free to details discussion before placing an order so that I can provide you p...","excel spreadsheets | formulas | functions | macros |, duplicates formula automation, data validation conditional, hlookup index-match, sumproduct countif, excel formula, different cells formula, gig, excel sheet, excel spreadsheet"
Pricing Engine,"I need a pricing engine written in C#. The would be a C# method which will be used in a larger ASP.NET project. The aim of this method is to calculate and return the applicable prices based on the input parameters, like user, sports field, date, time etc. I detailed specification is attached.","c #, pricing engine, larger asp.net project, input parameters, sports field, applicable prices, aim, user, date, time"
PDF print from NetSuite to HP Printer -- 2,"Hi, We are in need of a functionality to automatically print the Packing Slip (from an item fulfilment) from NetSuite via our HP printer. Currently we print out these PDF documents by hand, but we need to automate this. We are using NetSuite WMS, and once an item fulfilment changes status from ""Picked"" to ""Packed"", it needs to automatically print out the PDF. If you have an idea on how to achieve this, please let me know!","packing slip, pdf print, item fulfilment, pdf documents, netsuite wms, functionality, need, hand, status, idea"
Looking for an individual translator from Spanish to English,Hi freelancers! I am looking for an translator from Spanish to English. There are a few pages to translate. I will provide docx file. Thank you.,"individual translator, spanish, english hi freelancers, english, docx file, few pages"
Prototype in React and AWS Amplify,Pre-seed startup with secured funding is looking for a backend developer expert in AWS Amplify and frontend developer expert in React to build the first MVP.,"aws amplify pre-seed startup, backend developer expert, secured funding, react, aws, prototype, first mvp"
Online Area Managers - Each of 5 countries - Work From Home,We need someone that will handle and recruit music raters in one whole country.,"online area managers, music raters, home, countries, whole country"
Transfer Websites Between Siteground Hostings -- 2,I will be acquiring new Siteground Hosting in the BFCM sales and need my websites transferred from my previous Siteground hosting to the new hosting. Normally Siteground would help with these transfers but apparently they are reluctant when switching between plans during Black Friday sales. (I can’t afford their full hosting and don’t have time to research others). There will be seven websites in total as well as emails on 2 of the accounts. I hope to do this later this week.,"new siteground hosting, black friday sales, siteground hostings, bfcm sales, previous siteground, transfer websites, transfers, plans, time, emails"
