title,abstract,keyphrases
Xamarin App Developer,"Hello I have an App in Xamarin Forms which I needs to uploaded to App Store for iOS . It uses UIWebview which needs to be replaced with WKWebview as I am getting this issue when trying to upload , so needs to be updated & app needs to be uploaded to store .","xamarin app developer, xamarin forms, app store, ios, uiwebview, wkwebview, issue"
Kickstarter expert,I wish to launch a new product - Basharama on kickstarter [login to view URL],"kickstarter expert, new product, basharama, url"
Advice & Guidance Premium Phone Website,"The project is for people in different fields to register on the site, set up a profile, and they can set their own availability or online/offline status. When user has chosen online, they can be called by anyone selecting for that guidance using a phone number with an extension.","guidance premium phone website, offline status, different fields, phone number, advice, project, people, site, profile, guidance"
Mobile Development Project,"Create two mobile applications as below: 1. Mobile application for customers mimicking features of existing customer web portal providing customers the ability to book repair service, check the status of their repair ticket, check the status of parts ordered, and receive notifications and alerts for various events such as parts arrived, technician on the way, etc and communicate and respond to company messages. 2. Mobile application for technicians to receive work orders with work details, and update work done, parts installed, services completed, and be able to receive customers' signatures and receive payments. using our existing payment gateway.","mobile development project, mobile applications, customer web portal, repair service, repair ticket, company messages, customers, parts, work orders, work details"
Book Keeping,Book Keeping wherein we need help in understanding Accounting entries,"book keeping book keeping, accounting entries, help"
"Ongoing Project Management - Managing a team of 4 developers, 2 designers and 3 social media experts","We are looking for a Management Guru. You must have experience with managing large/medium teams who work on social media platforms, cultivating and growing a community by engagement, ideas for onboarding, creating and managing groups, commenting and responding in groups or in direct messages and tracking metrics to show progress. Working within an overall timeline and structure. Prior to starting, you will review our existing platforms, procedures, processes, provide an assessment and brief plan for moving forward. ***Please read full project details.*** We are looking for someone that is fluent in English, written and spoken. We will need to have a video call to test your connectivity as well as to get to know you. Responsibilities: Under general supervision and direction, manage the p...","ongoing project management, social media experts, management guru, medium teams, direct messages, team, developers, designers, groups, overall timeline"
Sharing Paring jobs,"Here, I have a plan of having profit from both side in equal amount I want projects of yours where I can help out others like MS word projects , excel works etc.. conversion of jpg. files to pdf . *Plan* is : Project fund will be given to me of ₹600 If I will do half work then full refund work done properly then the half of the money will be refunded back... Ex :- Amount while giving project amount will be ₹600 Work done (Fully)- Then amount will be half distributed (300+300 =600) Work incomplete then -Full refund !! ~Thank You """"The above plan will be followed strictly from my side rest depends ...","paring jobs, excel works, project fund, projects, ms word projects, profit, conversion, plan, work, half"
Resume Update -- 2,I need to update my professional Resume.,"resume update, professional resume"
Private project or contest #35340080,Empty String,"private project, empty string"
Creative Copywriter,"Full Job Description Job Description: Create written content including product listings, advertisement and marketing campaigns, social media content, EDM Create and deliver delightful ideas for promotions Work closely with internal teams and vendors to maintain smooth business workflow Perform ad-hoc marketing tasks and projects as assigned Job Requirements: Any related discipline with more than 1 year relevant working experience Responsible, self-motivated and well disciplined Strong ownership with good execution skills Able to adapt fast-changing ecommerce work attitude Independently and effectively work under daily time constraints Interest in sexual wellness and sex positivity, and promote sex education will be a huge advantage Experience in social media management is a plus Experien...","creative copywriter full job description job description, fast-changing ecommerce work attitude, daily time constraints interest, social media content, ad-hoc marketing tasks, huge advantage experience, smooth business workflow, relevant working experience, good execution skills, job requirements"
Need someone who knows assembly language,I need someone who knows assembly language and can make a digital clock using this language. URGENT.,"assembly language, digital clock, urgent"
ux/ui developer,"create a ux/ui developer Requirement: · Good at Photoshop, Illustrator, Figma and Adobe XD. · Good at UI/UX Designing and Analysis (Website, Mobile App, Wireframes. · Creative Logo Designing, layout designing, Banner Designing. · Good English Communication skills. · Prepare and present rough drafts to internal teams and key stakeholders. · Team spirit; strong communication skills to collaborate with various stakeholders","good english communication skills, creative logo designing, mobile app, banner designing, strong communication skills, layout designing, photoshop, illustrator, figma, ui developer requirement"
I need a photo editor  -- 2,I photographed a wedding and I don’t have time to edit it atleast 500 images,"photo editor, wedding, time, images"
I need a photo editor,I photographed a wedding and I don’t have time to edit it atleast 500 images,"photo editor, wedding, time, images"
Need a chemical engineer -- 2,Need a chemical engineer to help with drawing a process flow diagram for a chemical process. 10 minutes job if you know what you are dealing with.,"chemical engineer, chemical process, minutes job, diagram"
Calculator,"Graduate in information technology,. CHM 'O' level , Strength -. Hard work -. Positive attitude","calculator graduate, information technology, hard work, positive attitude, chm, strength, level, o"
Text Detection & recognition OCR,"i want you to extract specific information from invoice. u are free to use any available open source like PaddleOCR, Tessract, easyOCR etc...","text detection, recognition ocr, specific information, available open source, invoice, paddleocr, tessract"
Convert web pages to React Js,We are looking for experienced developers with ReactJS. We will inform you of the details in connection with each other. check it.,"convert web pages, experienced developers, reactjs, details, connection"
Entrepreneur looking for an Experienced SCRIPT WRITER,Our company is a growing data science startup completely remotely based. Our mission is to provide the best data science education tools and career platform for all aspiring data scientists looking for jobs or....,"best data science education tools, experienced script writer, data science startup, data scientists, career platform, entrepreneur, company, mission, jobs"
"Restaurant design, kitchen layout for USA territory..","Hello to all, I am looking for someone to create a restaurant design opted for the USA. Meaning, you must have prior experience designing a restaurant dining room, kitchen and bathrooms for businesses in the USA. This is what I've done so far... 1. I already have the floor plan laid out with the equipment and workflow. 2. I have created a folder in Pinterest so you can get an idea of what I am looking for. 3. I will be needing your experience in order to suggest better workflow options and designs that will help me optimize my budget. Here are the requirements: 1. You must have prior experience with restaurant layouts. 2. Proof of past work of commercial kitchens, restaurant layouts 3. Must design Restaurant with current products that are available to purchase either online o...","usa territory, kitchen layout, restaurant dining room, restaurant design, restaurant layouts, prior experience, floor plan, better workflow options, meaning, bathrooms"
Need an app like Exness TP Global with full feautres,"Hi ,i want an app like exness like Trading Broker app ,with both Platform ,android and ios Please let me know your previous projects and also i need full support till the app launch","trading broker app, app launch, previous projects, exness, platform, exness tp global, android, ios, full feautres, full support"
Freelance Content Editor,We are looking for awesome editors who love Editing! We need you to edit and deliver consistent high-quality content.,"freelance content editor, consistent high-quality content, awesome editors, editing"
Assistant supervisor lvl,I am having an international opportunity for youngsters through which you can earn 30k-35k per Month. You have to work through online.,"assistant supervisor lvl, international opportunity, month, youngsters, online"
Subtitle for video,I need subtitle for this below link video. Please check video before bid Thanks These are two video. Budget $15,"link video, bid thanks, subtitle, budget"
Linux Operating System Development With C,"Hello, For this job, I need an expert with the Linux base system, who understands the ins and outs of the kernal very well. I will give a zip file, with a C soure code and other 3 other files located in it. There will be 9 asked, those questions will be based on the functionality of these files. This is a very small job, and needs to be done by December 5th. Feel free to view the sample code, the questions will be given once the job has been accepted.","linux operating system development, linux base system, zip file, december 5th, expert, ins, outs, kernal, sample code, small job"
do-follow backlinks with indexing and not blocked by robots.txt or any meta,"I need tons of do-follow backlinks with indexing and not blocked by or any meta in page source, to make sure you're not spamming write this word purple in your offer so I can see it and make sure you provide good backlinks like edu and gov","do-follow backlinks, good backlinks, page source, word purple, meta, indexing, tons, offer, edu, gov"
Social Media Content Creation,"We are in need of a talented individual or company to help create social media contents for our business. Persons must have a good knowledge in social media management and marketing as well as a good eye for post design. Posts must include videos, carousels, reels, stories, etc. Graphics design skills are extremely important too. Thank you","social media content creation, social media contents, talented individual, graphics design skills, good knowledge, good eye, post design, need, company, business"
OCR Extract specific text from Random invoices,"i want you to extract specific information from invoice. u are free to use any available open source like PaddleOCR, Tessract, easyOCR etc...","ocr extract, random invoices, specific text, specific information, available open source, invoice, paddleocr, tessract"
"20 dollars to copy a WordPress theme, exactly the same. Do not exceed the budgeted amount. Complete within 2 hours","20 dollars to copy a WordPress theme, exactly the same. Do not exceed the budgeted amount. Complete within 2 hours","wordpress theme, dollars, hours, amount"
Back Links Needed for a website,"Send me the number of back links you can create and the costs. I will need a report for validation. No website scan needed, just back links. Send me me price and numbers of back links per week or based on price. Niche Automotive Spam score less than 34 DR 30 Ahrefs","niche automotive spam score, number, costs, links, website, price, report, validation, ahrefs, week"
Medical immaging segmentation,I need someone who is an expert in deeplearning,"segmentation, expert"
Need an ArchiveLink content server Prototype,"Project Overview I would like to have an SAP ArchiveLink HTTP 6.4 content server prototype created in Python. I'm okay with the prototype using any free python packages. It needs to run on both Windows and Linux. Since it is Python this should not be a problem. The prototype needs to properly handle SAP (BC-SRV-ARL) requests. It’s a simple protocol, but one component of the requests (the secKey) is complex. I am looking for the prototype because I don't know how to decode and use the secKey. You need to develop and test this prototype on your own systems and with your own SAP. I only want to be sent code you believe meets the requirements. Prototype Requirements I need for the prototype to accept the key sent by SAP by the putCert request and use that to decode subs...","archivelink content server prototype project overview, sap archivelink http, free python packages, prototype, python, sap, simple protocol, requests, decode subs, seckey"
Design the logo,We need someone to design our startup's portfolio,"logo, startup, portfolio"
Nonparametric Statistics,Need an expert who can handle nonparametric statistics project remotely.,"nonparametric statistics project, expert"
Master Affordable django developer,"im looking for a django developer to create and develop a backend. the project front end is developed with flutter, so I prefer the developer to have some dart knowledge as well. the app might require a smart contract connection to it.","master affordable django developer, smart contract connection, dart knowledge, backend, project, flutter, app, front end"
Editor de vídeo para YouTube (3$/h),Necesito editor hispanohablante para vídeos y shorts estilo @patrickdang/videos y @patrickdang/shorts,"necesito editor hispanohablante, vídeo para youtube, editor, @patrickdang, videos y @patrickdang, vídeos y"
Wordpress (LMS Plugins) for my LMS Website -- 3,"Hi Wordpress (LMS Plugins) professionals, Suggest me for wordpress LMS plugin for course content listing tutorial blog, in my LMS Website Refer This for Different LMS Plugins for Course Content Creation & Presentation.. Require: What Are You Looking for in These WordPress LMS Plugins? My Requirement: Refer this for my Required Lasyout in Course Page (my Website - Courses Pages) Curriculum must be similar to this way of Presentation. Setup the appripriate Plugin & Also Add some content (sample) so that I will edit it once Im ready with my Course content. I think this is appropriate LMS Plugin.. ""Learnpress LMS"" Create course Manage course Any Issues? no worry. Pls reply to discuss in detail & make the Deal Btw. Little Low Budget, as its simple task, for Wordpr...","wordpress lms plugins, course content creation, lms website, tutorial blog, course page, learnpress lms, wordpress, create course, required lasyout, appripriate plugin"
Video Editor,"We are in need of a video editor to edit sports videos in a large project. There are roughly 50 videos of 4-6 minutes that need editing in the next 45 days. We already have a Premier Template to use and would require the editor to put the clips together, use their initiative to add the broll (that we provide), create 1 or 2 graphics per video and add short text titles during the video. (Video editing must be in Premier as that is our template) Here is an example of one our videos and you can see the text and graphics we are referring to:","large project, video editor, sports videos, short text titles, premier template, video editing, need, graphics, minutes, days"
adding vpn sdk from aura developer  -- 2,developer should have account with developer. aura .com developer must add vpn sdk in our exiting android project thank you,"vpn sdk, aura developer, android project, account"
Convert Excel spreadsheet into membership dashboard website,"I have an Excel spreadsheet containing various charts and outputs calculated using user input values. The spreadsheet has a Dashboard tab and other tabs representing the pages required. The main requirement of this project is the ability to convert the Excel document into a fully functioning dynamic website. 1. A website where users can sign up for free with just their name, email and password. 2. Once signed up, users input their information for the calculations to run (full account setup). Until this is completed, they should see a holding page. 3. A dashboard page to show high level charts/graphs etc. There will also be other pages where the user can see more specific information. All of this is contained in the spreadsheet. 4. The user can upgrade their account to a paid membership...","convert excel spreadsheet, user input values, membership dashboard website, dashboard tab, excel document, dashboard page, functioning dynamic website, outputs, high level charts, main requirement"
Wordpress (LMS Plugins) for my LMS Website -- 2,"Hi Wordpress (LMS Plugins) professionals, Suggest me for wordpress LMS plugin for course content listing tutorial blog, in my LMS Website Refer This for Different LMS Plugins for Course Content Creation & Presentation.. Require: What Are You Looking for in These WordPress LMS Plugins? My Requirement: Refer this for my Required Lasyout in Course Page (my Website - Courses Pages) Curriculum must be similar to this way of Presentation. Setup the appripriate Plugin & Also Add some content (sample) so that I will edit it once Im ready with my Course content. I think this is appropriate LMS Plugin.. ""Learnpress LMS"" Create course Manage course Any Issues? no worry. Pls reply to discuss in detail & make the Deal Btw. Little Low Budget, as its simple task, for Wordpr...","wordpress lms plugins, course content creation, lms website, tutorial blog, course page, learnpress lms, wordpress, create course, required lasyout, appripriate plugin"
Vuejs + Laravel,Hello We use this theme Then we need to make some work on it. We're looking for someone can work with us for long term You should know very well Vuejs and Laravel,"laravel, vuejs, long term, theme, work"
Product Sourcing Malaysia,"Product sourcing of Local Malaysian Herbal Supplement is required. The product sourcing should include details of product registration with KKM Malaysia, manufacturer contact details. Qualified freelancers from Malaysia only with Pharmaceutical knowledge and experience are invited to bid and may contact me for further details upon agreement.","local malaysian herbal supplement, product sourcing malaysia product sourcing, manufacturer contact details, kkm malaysia, product registration, pharmaceutical knowledge, qualified freelancers, details, experience, agreement"
website-26nov2022,"Need someone to update few contents on a WordPress website which is in English & Arabic. Bid only if you are familiar with Arabic language. Changes will be made on text, background color, images, and small update in layout for one page.","wordpress website, arabic language, small update, english, background color, website-26nov2022, bid, changes, text, images"
do-follow backlinks with indexing and not blocked by robots.txt or any meta,"I need tons of do-follow backlinks with indexing and not blocked by or any meta in page source, to make sure you're not spamming write this word purple in your offer so I can see it and make sure you provide good backlinks like edu and gov","do-follow backlinks, good backlinks, page source, word purple, meta, indexing, tons, offer, edu, gov"
"✨Earn US$1,200 - US$2,400/book Regular Monthly Income✨Werewolf Shifter Romance Writers Needed✨","Dear Writer! We are looking for 4 qualified writers who are proficient in werewolf paranormal shifter romance stories. Job details: - Series, 100k-120k word count / book - 5-10 books / series - US$1-US$2 /100 words, based on your writing skills - General Procedure: story idea--outline--writing Communication is very important. While writing, you could send the chapters you write to me and my team, we will read them and give you some suggestions or ideas to make the story better. We are offering a long-term and stable job. If you're interested, please send your samples to us. Start the application to this job with the word ""apple"", so I know you have read this posting through, and I will use that as a screening tactic. Looking forward to working with you!","book regular monthly income ✨ werewolf shifter romance writers, werewolf paranormal shifter romance stories, general procedure, qualified writers, ✨ dear writer, job details, /100 words, word count, series, writing skills"
"Android, ios and webpage",Enterprise app development. Will provide later,"webpage enterprise app development, android, ios"
unity kinect game -- 64647,"Your requirements; gameplay programming for the 5 scenes below, HUD and loading scenes using the assets in the list at the end of the post there are 5 stages with a story and a missiton to accomplish before a stage is completed. 1. swat-shooting gallery (Unity asset) for archery and darts. Effects for arrows and darts. It's a training boot-camp 2. sim-city looking shooting scene to penetrate and assasin a boss, (City asset is provided and the look should be localized with some signs in Korean and a landmark building to be created); Assembly bulding annex where a politician is removed (kidnapped, killed or locked away for good) 3. Office building that should be breached and steal away a scret vault or sensitive data from their servers 4. A bank hq to kill every security guards in the ...","unity kinect game, gameplay programming, scenes, unity asset, hud, swat-shooting gallery, requirements, assets, list, end"
fix dropdown filter,fix dropdown filter not working bootstrap work via anydesk,"dropdown filter, bootstrap work, anydesk"
Behavioural Competencies Assignment,Need to make a report in 2500 words. We have to build a virtual Team for any organisation of our choice and explain how we are going to hire the team. The key information that I need to add in the report is to understand my personality as a manager and what kind of people I am looking for in my team. Also need to explain how I will manage the team (Like for example how will I tackle the time zone differences in my team because the people could be from various countries). Below I will add the exact description of the project and a few screenshots of 2 sample reports(as much as I could find) This is my resubmission so I need very good scores for this. Need genuine people who can help me score above 90% for this. Also plagiarism is strictly prohibited. The piece of work needs to be pure...,"behavioural competencies assignment, time zone differences, virtual team, words, key information, genuine people, report, exact description, sample reports(as, good scores"
"Android, ios and webpage",Enterprise app development. Will provide later,"webpage enterprise app development, android, ios"
unity kinect game -- 64647,"Your requirements; gameplay programming for the 5 scenes below, HUD and loading scenes using the assets in the list at the end of the post there are 5 stages with a story and a missiton to accomplish before a stage is completed. 1. swat-shooting gallery (Unity asset) for archery and darts. Effects for arrows and darts. It's a training boot-camp 2. sim-city looking shooting scene to penetrate and assasin a boss, (City asset is provided and the look should be localized with some signs in Korean and a landmark building to be created); Assembly bulding annex where a politician is removed (kidnapped, killed or locked away for good) 3. Office building that should be breached and steal away a scret vault or sensitive data from their servers 4. A bank hq to kill every security guards in the ...","unity kinect game, gameplay programming, scenes, unity asset, hud, swat-shooting gallery, requirements, assets, list, end"
fix dropdown filter,fix dropdown filter not working bootstrap work via anydesk,"dropdown filter, bootstrap work, anydesk"
Behavioural Competencies Assignment,Need to make a report in 2500 words. We have to build a virtual Team for any organisation of our choice and explain how we are going to hire the team. The key information that I need to add in the report is to understand my personality as a manager and what kind of people I am looking for in my team. Also need to explain how I will manage the team (Like for example how will I tackle the time zone differences in my team because the people could be from various countries). Below I will add the exact description of the project and a few screenshots of 2 sample reports(as much as I could find) This is my resubmission so I need very good scores for this. Need genuine people who can help me score above 90% for this. Also plagiarism is strictly prohibited. The piece of work needs to be pure...,"behavioural competencies assignment, time zone differences, virtual team, words, key information, genuine people, report, exact description, sample reports(as, good scores"
Contcation building,Hii is contcation building is a,contcation building hii
Freelance Copywriter,We are seeking to hire a forward-thinking Copywriter with a focus on creating engaging content that resonates for any given mandate.,"freelance copywriter, forward-thinking copywriter, focus, content, mandate"
SEO Service and Web Maintenance,We are seeking an experienced SEO and web management team for a new website,"web management team, seo service, web maintenance, experienced seo, new website"
create en e-mail .edu with credentials,"I need an e-mail .edu, from USA, with credentials","e-mail .edu, credentials, usa"
