title,abstract,keyphrases
Need a react developer,Hey There! We are looking for some Individual Freelancers for React & Flutter. The hourly rate is $5 ~ $8 Thank You!,"react developer, individual freelancers, hourly rate, flutter"
logo for a cafe,RED DRAGON THE URBAN CAFE,"cafe red dragon the urban cafe, logo"
Suvision holding company,"Marketers are responsible for planning, creating, and executing marketing campaigns to expand their company’s reach and potential customer pipeline. A marketing job description should include the necessary qualifications, responsibilities, and skills required for success in the role.","potential customer pipeline, company marketers, marketing job description, marketing campaigns, necessary qualifications, suvision, planning, reach, responsibilities, skills"
Android developer,"We have an android app written in Java, have bugs to be fixed","android developer, android app, java, bugs"
Web Application Development - GRC,"GRC Tool Development • Governance, risk management, and compliance (GRC) is a framework for managing these three practices across an organization. • This is going to be a web application. • You should be able to whitelable. Features that this tool should have: • It should be multi-tenant • This is going to be mostly based on questions that the a client should be answer and for the options that they choose they should be able to upload the document. • You should be able to create a client and assign a framework. • Each Framework will have sub sections which will have questions (mcq type). For example under a particular client we have selected HIPPA framework, and you see sub sections and under sub sections you see questions, and you have a place where....","grc grc tool development, web application development, risk management, sub sections, hippa framework, compliance, practices, organization, questions, particular client"
Need a flyer designed,"I need a flyer designed I will share the pictures and stock numbers in a PowerPoint. I need this converted into a professional looking flyer similar to this, as close as possible I need this done fast - within 1 day max. Only contact me if you can immediately work on this. $50 is the price, with a bonus for completing . You will get more projects if this is done well. Here’s the file with picture, price and item number","stock numbers, flyer, day max, powerpoint, pictures, item number, price, bonus, file, more projects"
Change Design of List View Layouts,Need a Change in List view of Two Activity the App is Built on Java(Android Studio) .,"list view layouts, java(android studio, change, design, activity, app"
Writing and translating,I need writer to help me translate from english to any other local or international language,"international language, writer, english"
company business card,Am in need of a new business card for my company,"company business card, company, need"
Algo Developer needed for Banknifty Strategy in Python,Algo Developer needed for Banknifty Strategy in Python - Straddle with Shift on SL,"python algo developer, banknifty strategy, python, straddle, shift, sl"
Build custom web browser in DELPHI,I need a basic custom webbrowser using CEF4DELPHI,"custom web browser, basic custom webbrowser, delphi, cef4delphi"
Video production expert required,Video production expert required. Pls place bid if you can start now,"video production expert, place bid"
Need API Dev and payment gateway expert for backend(php).  -- 2,Need API Dev for backend(php) who can help my app developer in fixing some issues: Create new API and make some modifications in existing API. And also issue in paymeny gateway NOTE: budget upto 1K INR,"need api dev, payment gateway expert, paymeny gateway note, new api, app developer, backend(php, budget upto, issues, modifications, k inr"
Record an audio with a male voice,"I have a 60 seconds script which I would like to be recorded by an voice over artist, its has be in very high pitch and with a male voice","male voice, seconds script, high pitch, audio, artist"
osticket customization,osticket customization on ubuntu,"osticket customization osticket customization, ubuntu"
Linkedin Chrome Extension,"I am looking for someone to help me build a chrome extension. The extension will have 3 tabs, Notifications, My network and My messages. When you click on the extension icon, it will show the 3 tabs and let;s you view your notifications without going to Linkedin. It will also mark them as read. Finally, in the messages section, I should be able to reply to messages.","linkedin chrome extension, extension icon, messages section, notifications, tabs, linkedin, network, let;s"
Independent sales representatives  -- 3,"NO BRAND COMPANY is the inventor and global supplier of ""thisCase"" a new , patented case for smartphones, you can find all about it in our website : We need independent sales representatives for USA, UK mostly but we can deliver to every country We are looking for a long time cooperation and we offer high commissions and exclusivity. Please send us a message about your plan","independent sales representatives, long time cooperation, brand company, global supplier, high commissions, usa, inventor, thiscase, case, smartphones"
Data entry analyst,URGENT REQUIREMENT - Max 24 Hours have 2 datasets with maximum 1000 records and 8 variables combined. I am squeezed for time and need an analyst that could do some basic analysis of the data. Thanks ?,"data entry analyst urgent requirement, basic analysis, max, hours, datasets, records, variables, analyst, data, time"
Bernese 5.2 -- 2,Bernese 5.2 I am looking for someone who can teach me this software on how we process a data please contact me if you are interested in Thank you in advance,"bernese, software, data, advance"
amazon dropshipping,Odoo comes with a great selection of building blocks. Drag and drop them to create stunning pages. Building a website has never been so easy.,"great selection, odoo, stunning pages, amazon, blocks, drag, website"
SEO Reporting & Presentation Expert,"I'm looking for an SEO professional, who can create SEO strategy reports with well designed templates.","seo strategy reports, seo reporting, presentation expert, seo professional, templates"
C++ Expert Needed,"I have simple C++ code to complete. I already have code, but some change is needed. I attached file. Please contact me.","simple c++ code, c++ expert, code, change, file"
Graphics design,I need a serious and accurate freelancer who can handle this project properly,"graphics design, accurate freelancer, project"
React / Redux developer - EdTeach project,"Hi, We wish to get annotations developed for on screen marking (OSM) app. We have done the entire app except annotations. We only need Front End in React. OSM and Annotations Ref -","redux developer, edteach project, annotations ref, entire app, react, osm, screen, front end"
Brand development and Marketing Project,We need graphic designers and social media designers for our brand.,"social media designers, marketing project, brand development, graphic designers"
Need API Dev and payment gateway expert for backend(php).,Need API Dev for backend(php) who can help my app developer in fixing some issues: Create new API and make some modifications in existing API. And also issue in paymeny gateway NOTE: budget upto 1K INR,"payment gateway expert, api dev, paymeny gateway note, new api, app developer, backend(php, budget upto, issues, modifications, k inr"
Recycled plastics content creation,Looking for someone to generate several technical cut sheets for recycling of plastics and a white paper about the benefit of recycling.,"recycled plastics content creation, several technical cut sheets, white paper, recycling, plastics, benefit"
Build me a Movie Recap Video + Shorts,"I need assistance putting scenes together for a movie recap youtube channel. I am looking for a long-term, working, relationship with a freelancer who has experience placing these together quickly! I want to create 15 long form videos per month, as well as 5-10 short term videos per month.","movie recap youtube channel, movie recap video, short term videos, long form videos, shorts, assistance, scenes, month, relationship, freelancer"
Backgammon online tenement and online game,"I like to have a online backgammon website som included in: 1. Registration 2. Charging account by crypto and cash out by crypto 3. Different tables , players can play free or different prices levels 4…. Etc","online backgammon website som, online tenement, online game, different prices levels, backgammon, different tables, crypto, registration, account, players"
Design a logo,"Logo for madoors Who teaches literature, chemistry, technology and Art.","logo logo, art, madoors, literature, chemistry, technology"
Mystery Shopper Dominican Republic,"We are in need of mystery shoppers in Dominican Republic. Get paid when you refuel! Yes, it is like FREE Fuel! We are looking for mystery shoppers for a gasoline company. You just need to visit the station, refuel, take note customer experience, take some pictures and answer the online questions for the evaluation. Requirements: 1. Has driver’s license 2. Observant and has good attention to detail 3. Smartphone / computer for submission of evaluation 4. Age 18 and up This is not an employment; you can do this part time. You decide what evaluations to take / accept that would fit your time availability. We have different evaluations in various retail industries, such as fashion, sports, grocery, jewelry/ watches, vehicles and many more. To be considered in this evaluation just visi...","mystery shopper dominican republic, mystery shoppers, free fuel, note customer experience, gasoline company, evaluation, online questions, time availability, need, different evaluations"
Need someone who speaks fluent English,We are looking to hire who speaks fluent Mandarin. This person must provide high energy with clear pronunciation and creativity. We have our youtube channel as well as our tutorials that are on our website. Requirment: Voice over mp4 files Caption for voice over,"fluent mandarin, fluent english, high energy, clear pronunciation, youtube channel, voice, person, creativity, caption, tutorials"
Social Media Management,Freelancer to handle reels and post for social media pages. Creating engaging content for the target audience.,"social media management freelancer, social media pages, target audience, engaging content, reels, post"
Pytorch segmentation,Need an expert who knows about and can Implement Deep Learning Models By Pytorch For The Dataset.,"deep learning models, pytorch segmentation, dataset, expert"
Python developer needed to build web scraper that collects data for affiliate marketing,"Web scraper should scrape through list of 30 basketball and sports blogs collecting web traffic data, detecting and recording sales funnels (through CTAs etc.) and contact info, then copy the collected data to an Excel sheet. List of websites will be provided.","sports blogs collecting web traffic data, affiliate marketing web scraper, python developer, sales funnels, excel sheet, contact info, ctas, data, basketball, list"
Kotlin developer for existing mobile app,We are looking for a long term colleague for our project. At least 2 years of experience are required. Only apply if you live in Hungary or Central Europe. Thanks!,"long term colleague, kotlin developer, mobile app, central europe, project, hungary, years, experience, thanks"
iOS developer for existing mobile app,We are looking for a long term colleague for our project. At least 2 years of developer experience are required.,"long term colleague, mobile app, ios developer, developer experience, project, years"
"Menu , marketing promotional flyers","Design menu card , flyers , posts etc for a Cafe","promotional flyers design menu card, cafe, menu, flyers, marketing, posts"
Pergolia revit project,revit work for pergolia. need only revit expert,"pergolia revit project revit work, revit expert, pergolia"
parallel programming,All the three tasks should be done parallel programing with C and also compile and run in CStar.,"parallel programming, cstar, tasks, c"
Creating and syncing voice over and script in Arabic for existing infographic animation video,I have an infographic animation video with all source files in English. The project scope is to create and sync voice over and script in Arabic. I can translate the script in Arabic and provide it along with source files. Please do not offer unless you are 100% know what you need to do. Maximum lead time is 2 working days including previews.,"infographic animation video, source files, arabic, project scope, maximum lead time, script, english, voice, days, previews"
Business proposal,Wellness resort Which includes real estate,"business proposal wellness resort, real estate"
Redesign tables/diagrams already in pdf/images into editable word or format,"I need an expert designer in pdf edit or who can redesign Tables in a different format, and make them editable in word so that we can change texts in the tables and diagrams. Provides completely new designs for the tables, but just makes the diagrams editable. The tables/diagrams are in pdf/images, so we need someone who would redo and redesign the tables one by one. The file has about 7 tables and 7 diagrams","expert designer, different format, editable word, pdf edit, redesign tables, diagrams, new designs, texts, images, file"
Photo of my dog's face photoshopped into famous paintings,"Hi there, I'm hoping to make a calendar for Christmas for my mum. I would like a picture of her dog's face photoshopped into twelve famous pieces of art e.g., the Mona Lisa. So, the final picture would be the Mona Lisa, but it would have my mum's dog's face instead of the original face. It would be great if you could change the colour/style of the photo to match the style of the painting, but we could chat about how difficult this might be or how much time it would take. Thanks so much, James","mona lisa, famous paintings, famous pieces, original face, christmas, dog, final picture, calendar, mum, photo"
I need someone who has EXISTING source code for TURO.com - READ before posting,"I need to scape and post. Only bid if you ALREADY have the source code. In your bid write, Already have Source code or else your post will be ignored.","existing source code, bid write, turo.com, post"
design a logo for a teching office called madoors,"logo for madoors Who teaches literature, chemistry, technology and art","madoors logo, office, literature, chemistry, technology, art"
Entrepreneur looking for an Experienced SCRIPT WRITER,Our company is a growing data science startup completely remotely based. Our mission is to provide the best data science education tools and career platform for all aspiring data scientists looking for jobs or anyone interested in improving their data skills.,"best data science education tools, experienced script writer, data science startup, data scientists, data skills, career platform, entrepreneur, company, mission, jobs"
Publish an app to IOS /Android in addition to configure pricings on both platforms with some small changes in code,"good day everyone, my name is Abdul and i have a mobile/ web app that are 99% done in development, we need a little help in configuring the pricing in addition to some other requirements, all explained in the .pdf attached. please read it very carefully and set your pricing accordingly. please do note that we already have a VPS configured and published.","web app, configure pricings, small changes, good day, little help, addition, ios, abdul, pricing, platforms"
Build me an app,I want to develop two apps . 1) An app the connects tailors and clients . The client uses his or her phone . Takes a picture and the app brings out the measurement. The app connects tailors and clients . Any tailor can register and also show case their work . The app has the ability to shows tailors around me . Python preferably. Second app.: I want to develop a food app and school app that connects people from different school but the same course . The food app connects people within the same region,"food app, apps, connects tailors, clients, people, different school, phone, picture, measurement, tailor"
Logo Design new business,Name of Company: GowRa #Oganic #Hydroponic #Microgreens capital letters G and R,"microgreens capital letters g, logo design, company, gowra, hydroponic, new business name, r"
Write academic article,I want different writers that can help me complete various forms of academic articles or literature reviews. I need a lot of writers to work with.,"academic article, literature reviews, different writers, lot, various forms"
Logo Design,I need a logo for my products. the products should be named with natureipo The products are natural essential oils and plant oils for care and healing. The logo should be small and monochrome green. I would like to have a psd file last which I can make small adjustments myself.,"logo design, natural essential oils, plant oils, products, small adjustments, monochrome green, psd file, natureipo, care, healing"
Transcript script,Transcript script to foreign language French Spanish German Italian,"transcript script transcript script, foreign language"
YouTube editing and thumbnail,We are looking for a talented and passionate video creator to do video edits and thumbnail creation. It will typically be for youtube content highlighting the world's best and worst with no person in the video. We will provide the voice over file and we will need you to create a video based on the audio file. The video materials will need to be sourced. We will provide creative guidelines for the style of video we require and what kind of thumbnails we need. Submission Requirement: Youtube video Thumbnail Required skills: Video sourcing Video editing Thumbnail creation The process is automated on Trello so there's no hassle with communication and submission. Everything will be logged timely. We are listing this based on hourly rate but we estimate each video will take a...,"youtube video thumbnail required skills, passionate video creator, video edits, thumbnail creation, youtube content, youtube editing, audio file, submission requirement, creative guidelines, world"
Tik tok/shorts content creator,I am looking for some to repurpose existing content on youtube into short form content and upload onto tik tok/ youtube shorts. 3 times a day content for tiktok page @alfred_dzadey,"tik tok/ youtube shorts, shorts content creator, short form content, day content, tiktok page, youtube, times"
Looking for someone who can build me an ios app using lidar and Roomplan API from apple,i need the app to scan in spaces for virtual tours and floorplans,"roomplan api, ios app, virtual tours, lidar, apple, spaces, floorplans, scan"
FOR YOUTUBE VIDEOS,I AM SACHIN AND I AM A YOUTUBER I want a man who is interested in cricket and can make both audio and video for my YouTube channel if anyone is interested. [REMOVED BY ADMINISTRATION; TERMS AND CONDITIONS : 13. COMMUNICATION WITH OTHER USERS],"youtube videos, youtube channel, youtuber, man, cricket, video, terms, conditions, communication, other users"
Need A Developer for Book App,Need A Developer for Book App Like class 1st to 12th All books. Find here the Attachment.,"book app need a developer, book app, class 1st, developer, books, 12th, attachment"
Need ABI of solidity contract address,Empty String,"solidity contract address, abi"
ASpike collection 3D modelling and product manufacturing,"I am an artist with a very unique but captivating sense of fashion. I need someone to bring my ideas to life 3D models and product manufacturing of Shoes for now heels, boots, etc","aspike collection 3d modelling, product manufacturing, artist, sense, fashion, shoes, ideas, heels, boots, life 3d models"
Create UI designs for an app based off of a wireframe,design a total of 8 different pages of a wireframe. The designs need to be professional and user friendly.,"wireframe design, different pages, app, total, designs, user"
Need an expert in Data Analysis using Python,Hello I need a Data Science expert using Matlab and Python Please revert if you have the required expertise.,"data science expert, data analysis, python, matlab, expert, expertise"
Proposal Facebook marketplace,"Hello, I have just started an online marketing agency. I am looking to bring somebody into my team to work with me. I need you to list and sell on marketplace. I have a client we can work with. very big client.","online marketing agency, proposal facebook marketplace, big client, marketplace, team"
I need a crash course into Ansible,"Hi, I want to use Ansible to manager configuration in my project. I need an expert trainer/instructor to run me though this list of topics: iptables ipset rt_tables interface (ip link/ip addr) routing (ip route) nginx localtime apply configuration check configuration state trace apply configuration (logs) detect that configuration changed monitor system/s for changes apply new configuration on host (the same host where ansible is running) inside docker (running on the same host) We might need multiple teaching sessions to cover all the topics. Ivan","configuration check configuration state trace, crash course, multiple teaching sessions, new configuration, expert trainer, iptables ipset, nginx localtime, monitor system, project, topics"
Build me a unrar project -- 2,Hello. I am looking for a rar unarchive node.js solution. If you have developed a similar on app or any other solution related to rar unarchive javascript kindly submit. Budget/milestone: $10/1 day Thanks.,"unrar project, unarchive javascript, day thanks, rar, solution, app, budget, milestone"
Sonatrach's 60th Anniversary Logo Design,"The logo should take into account the following characteristics:  Adopting the graphics or the Sonatrach label as a reference in the logo design;  To highlight the date of the sixtieth anniversary of the establishment of Sonatrach;  The logo must be institutional and reflect the image and reputation of Sonatrach;  The logo must be designed in both languages, Arabic and French. - The logo is presented in both monochrome and multi-colour formats;  It uses three colors (03 maximum) to be chosen from: orange, white, green, blue, brown and gray;  Suggest placing the logo on 3 different backgrounds  Specify color mixing percentages (RGB) (CMJN);  Be readily available in black and white.  To be submitted in the following three formats: JPEG, AI, TIFF;  It should be able to be copied and...","60th anniversary logo design, sonatrach label, sixtieth anniversary, color mixing percentages, following characteristics, multi-colour formats, arabic, different backgrounds, french, account"
I need a SEO experts and developer designer website,I need a Website designer an is website developer is needed kindly asap me here [Removed by Freelancer.com Admin],"developer designer website, freelancer.com admin, seo experts"
Engineerskosuri,We are looking for web application developers for our internal project that will collect work orders,"web application developers, work orders, internal project, engineerskosuri"
Customer Support Wanted Video/Audio Services  Preferably Female Candidates -Work From Home -- 7,"Dear Candidate(s), I am looking for customer executives preferably freshers female candidates who can assist my business. Job Description: Helping customer with their order related queries. Support via voice, email. Be familiar with Google Workspace, Skype, Excel English is compulsory. If candidate knows Bahasa Indonesia, Spanish, Filipino or Korean language, it would be plus point. Comfortably able to work four Hrs daily In European hours/Night shift. Work should be done in silent room. Face is not required at all. We will keep your dummy name. So 100% privacy is there. Candidates are not required to be In front of Pc/mobile during logging hours. Just make sure you are available during your logging hours. Candidate must be punctual & serious towards work. It is fun work. Make c...","customer support wanted video, preferably female candidates, audio services, dear candidate(s, customer executives, job description, home, google workspace, excel english, bahasa indonesia"
Engineers,Looking for web application developers who knows JSP / Servelets / Advanced Java,"web application developers, advanced java, jsp, servelets, engineers"
are you available for web developer and gravity designer,I need a Website designer an is website developer is needed kindly asap me here [Removed by Freelancer.com Admin for offsiting - please see Section 13 of our Terms and Conditions],"freelancer.com admin, website designer, website developer, web developer, gravity designer, section, terms, conditions"
Create a similar SMALL Website like Zedge -- 2,I want some one who can create a Small website like Zedge for wallpapers and ringtones. I need to have those functions : - Main page Browse wallpapers and ringtones with search bar and menu - Pop up to view wallpaper and ringtones like Zedge - Sign in / sign up page with facebook and gmail and simple email - upload ringtones and wallpapers page - Profile page,"similar small website, wallpapers page, upload ringtones, profile page, main page, zedge, search bar, simple email, sign, wallpaper"
