title,abstract,keyphrases
Experienced Senior Front end Developer needed -Freelance for tasks-immediate start,Excellence in all the following skills required: nextjs react redux webpack eslint html css,"nextjs react redux webpack eslint html css, experienced senior front end developer, excellence, -freelance, skills"
Hindi to Arabic translator of a YouTube video,Translate a 30-minute Hindi YouTube video and translate it into Arabic. Each sentence is on a separate line with a blank line between sentences with a time code. Only an Arabic native translator who also knows Hindi is required.,"youtube video translate, arabic native translator, blank line, time code, separate line, hindi, sentence"
Changes to employee contract in Odoo 16,We require an experienced Odoo developer with strong HR & Payroll experience to do the following changes Ref #01. - This is a modification to a 3rd party app - Adding two additional employee advantages in Cash to the employment contract with salary rules. - Adding three monthly advantages in kind to the employee contracts. -- These advantages in kind will not affect the payroll. -- Check advantages in kind with advantages in cash to validate (within the contract only) Looking for: - Positive Attitude + Good communication skills (English) - Ability to meet deadlines + Quality of work - Best coding practices and clean code without affecting performance - Ability to work in different timezones - GCC Payroll knowledge - Knowledge of using GIT,"experienced odoo developer, changes ref, additional employee advantages, gcc payroll knowledge, payroll experience, employee contract, 3rd party app, good communication skills, odoo, salary rules"
3D Animation Artist Needed For Skin weightpaint and Riging Only.,We need a 3D skinning and riging artist who can perfectly paint skin weightmaps for riging and animation for our game project model. Test file will be provided for your quality check. We need a artist who can work in time and can give us regular update about the work. Samples and money matter will be discussed in chat.,"skin weightpaint, game project model, skin weightmaps, artist, test file, quality check, animation, 3d animation artist, money matter, riging"
Design my new website logo,It's called 247Droptaxi. This is your project,"new website logo, 247droptaxi, project"
Copyright content writer for tech company,"We need someone to help us create excellent content for new built website. We locate in Vancouver, Canada so we would prefer writers who speak and write English as their first languages. We have included a sample of content we would like to have on our site Our business is also offering similar IT/website services so this link will give you an idea of what kind of business we operating.","copyright content writer, tech company, excellent content, website services, business, vancouver, canada, english, writers, sample"
Looking for a Front-end Developer and Graphic Designer,"We are looking for a front-end developer and graphic designer in one for a long-term partnership. The scope of work includes the creation of LP designs + new landing pages for sweepstakes and VODs (Affiliate Marketing verticals). We often create the same landing pages but in different languages for other countries. This means one of your tasks will be also placing orders for a language translation (on our partner's platform). The volume of work is not big, however, what we require is the response time. We would like to have new landing pages (when a pre-established design) ready within a day. Preferable time zone: within Europe (GMT+1, GMT+2). The onboarding training will be provided. **Required: HTML / CSS / JavaScript","front-end developer, graphic designer, affiliate marketing verticals, long-term partnership, new landing pages, preferable time zone, different languages, language translation, response time, work"
Website app development,Hi we need someone to help create a text to process map software Kindly check the document attached to see the scope of work Someone with experience on process maps,"process map software, website app development, process maps, text, document, scope, work, experience"
I need someone to find where on google maps this island exists!,I need someone to find where on google maps this island exists!,"google maps, island"
Computer Vision (Object Identification) for Meta Verse,"The project is not based on neural networks, but geometric shape manipulation. I had to post this project multiple tiines as none of the freelancers who applied read the project description and insisted doing things in their own way I will start contacting freelancers on Monday morning 1) Whenever applicable find matching shapes based on geometric features 2) Insert smaller pieces into larger ones and check if there is at least an average 50% of volume is overlap for both pieces combined and if so assign them as matching pairs for comparison 3) If there are no matching shape pairs based on geometric features or if 1st test failed then assign the unpaired shape in Object A to any other unpaired shape in Object B with closest volume overlap ratio 4) Any left-over unpaired shape will have 0...","geometric shape manipulation, closest volume overlap ratio, left-over unpaired shape, meta verse, matching shape pairs, object identification, computer vision, neural networks, geometric features, project description"
Integrate .Net webAPI,Integrate .Net webAPI with windows identity platform and create an email class to send emails,"windows identity platform, email class, webapi, emails"
wordpres developer,i need someone that can fix any issue on WordPress site I am getting an error on my site any time I try to upload an image saying Server responded with 0 code,"wordpress site, wordpres developer, server, issue, error, time, image, code"
upload my project to playstore,i want to upload my app or game to play store,"project, playstore, app, game, store"
2D transient analysis on fluent,I need to study the temperature distribution and gradient across a part in ansys Fluent in transient analysis. The mesh is ready. Dynamic mesh might be needed.,"transient analysis, ansys fluent, temperature distribution, dynamic mesh, gradient, part"
Hindi to Arabic translator of a YouTube video,Transcribe a 30 minute Hindi YouTube video and translate it into Arabic. Each sentence on a separate line with a blank line between sentences with time code. Only Arabic native translator who also knows Hindi is required.,"minute hindi youtube video, youtube video transcribe, arabic native translator, blank line, time code, separate line, hindi, sentence"
Digital marketing,"I need some design for advertising, Meta and google. Advertising sign design","advertising sign design, digital marketing, meta, google, design, advertising"
Build me a Simple code for algorithm with few entries,"I want CVD risk prediction using WHO 2019 charts, where I want if i put entries as Male/Female, Smoker/Non Smoker , Age, BMI and Systolic Blood pressure, it should show the risk using chart attached, with color coding also, simple Project, I will also pay if asked for reasonable amount. If any queries Contact me on +91 9897 038 115 WhatsApp","systolic blood pressure, cvd risk prediction, non smoker, simple project, simple code, color coding, male, female, age, bmi"
BJT and MOSFET multism,BJT and MOSFET multism,"mosfet multism bjt, bjt"
Develop Code-review Pipeline using AWS Devops tools.,1) Code-review Pipeline should be built using AWS tools only 2) It should review sql and python code and provide 1st approval on pull request. Share quotation only if you have worked on such task.,"aws devops tools, develop code-review pipeline, python code, pull request, 1st approval, share quotation, sql, such task"
Looking for a talented data scientist,"The goal is to assess the language proficiency of 8th-12th grade English Language Learners (ELLs). Utilizing a dataset of essays written by ELLs will help to develop proficiency models that better supports all students. Your work will help ELLs receive more accurate feedback on their language development and expedite the grading cycle for teachers. These outcomes could enable ELLs to receive more appropriate learning tasks that will help them improve their English language proficiency. Writing is a foundational skill. Sadly, it's one few students are able to hone, often because writing tasks are infrequently assigned in school. A rapidly growing student population, students learning English as a second language, known as English Language Learners (ELLs), are especially affected by ...","grade english language learners, talented data scientist, english language proficiency, ells, proficiency models, language development, appropriate learning tasks, second language, goal, accurate feedback"
create a wikipedia page,"for a brand, the best quote will be accepted","wikipedia page, best quote, brand"
instagram security,"I want to hire someone who knows how Instagram security , 2FA, recovery works.","instagram security, recovery works"
Python task with knowledge of tableau server,"Hi, This is a small task of removing unlicensed users from tableau group and then deleting this group. Task needs to be performed using python via API. Thanks","tableau group, unlicensed users, small task, python task, tableau server hi, knowledge, api, thanks"
"Integrate KNet , Visa and MasterCard","Hi, I do the payment extension for Opencart, payment need to make a success test with Bank to make it active","payment extension, success test, knet, visa, opencart, bank, mastercard hi"
install github imap fetcher code,"The max budget is $10 as you only need to install and configure You will need to install and configure the github code stated below , so that it can fetch emails from all providers like gmail,yahoo,hotmail,cpanel(hosting emails) and others.","github imap fetcher code, max budget, cpanel(hosting emails, emails, providers, gmail, yahoo, hotmail, others"
Intelligent Arabic Google ads Oud and perfume product in Saudi,Hi there We need to make a great googel ads We sell OUD and perfume Our aim is to increase sells using great keywords for SEO,"intelligent arabic google ads oud, great googel ads, perfume product, great keywords, oud, saudi, seo, aim"
Need a logo for my shoes store,Required - attractive logo and banner for my shoes store - Veronica Traders,"shoes store, veronica traders, attractive logo, banner"
Need ui/ux designer for web/mobile app,Need ui/ux designer for web/mobile app,"mobile app need ui, designer, web, ui"
Convert my project code from java to c++,I have a data structures project on metro management system which is in Java language. i just want to convert the code in c++ language and it should be working.,"data structures project, metro management system, java language, project code, c++"
Design Promotional Posters,"I need two promotional posters that will be used at the drive through of a restaurant. Poster #1: “Mexican Doble Cheese Burger” Poster #2: “Triple Threat Burrito” I have pictures of both meals. Will need to photoshop background and enhance the images. I want it to be an attention grabbing design, very enticing and appealing. Needs to be exciting, clear and make the customer want to buy","design promotional posters, triple threat burrito, doble cheese burger, poster, drive, restaurant, mexican, design, pictures, meals"
need to upload apps,need to upload applications in play market,"play market, apps, applications"
Looking For a Online Bidder for Website Development and SEO projects,"Job description: Online bidding is mainly through Bidding websites. Business and Revenue generation: Bid effectively to generate new business and branding. Proposal Writing: Writing proposals. Interact with clients to understand their technical requirements. Candidate should have basic knowledge of UPWORK, FREELANCER, PPH, GURU or any other portal. Follow up with clients if the proposal gets accepted and convert the lead into the successful project. Candidate must have good communication skills (written & Verbal). RoleBidding / Auction / Proposal Industry TypeIT Services & Consulting Functional AreaSales & Business Development Employment TypeFull Time, Permanent Role CategoryBD / Pre Sales Education UG :Any Graduate PG :Any Postgraduate","seo projects job description, business development employment typefull time, online bidding, online bidder, bidding websites, proposal industry typeit services, website development, permanent role categorybd, revenue generation, consulting functional areasales"
Rebuild a website,"I have a website, need to do some renovation and make it more interactive","website, renovation"
I need some project managers can recruit many speakers locally for the recording in recording studio,"##Project : Recoding conversation in a recording studio I need some project managers who can recruit many speakers locally for recording in a recording studio You need to go to the studio in a team of two to record conversations on topics such as travel, family, and marriage etc. It takes 1.25 hours to record. Language list: English(United Kingdom), I need 1000 person. French(France), I need 100 person. German(Germany), I need 100 person. English(United States),I need 100 person. English(Canada),I need 100 person. Korean(Korean), I need 100 person. Arabic(Saudi Arabia), I need 100 person. Arabic(U.A.E) , I need 100 person. What I need is: 1. Can you be a local project manager? We will pay you hourly wages or project bonuses. Tell me which language you could do? And how many people c...","recording studio, marriage etc, project managers, person, english(united kingdom, conversation, team, topics, travel, family"
Build SQL code from tableau worksheet,"Hi, Need to create a SQL code in SSMS from already built tableau worksheet. Looking for someone with experience in SQL complex queries along with good knowledge of tableau. Thanks","build sql code, tableau worksheet, sql complex queries, good knowledge, ssms, experience, thanks"
50 Travel Posts for Instagram for INR 5000,Hi Need 50 Travel realted posts for Instagram. Flight Doscounted Deals.,"travel posts, instagram, inr, deals, flight"
Need a motivation letter (for a law student),Need a motivation letter for a law student to apply to a traineeship program. 700 to 800 words.,"motivation letter, law student, traineeship program, words"
3 graphs required with the available matlab code (eigen value matrix),My project is about landing gear shimmy damper. I just want to get 3 graphs from available MATLAB code. I has to be analyzed and changed to get respective graphs. message me if you are interested.,"eigen value matrix, available matlab code, shimmy damper, respective graphs, project, gear"
Popup campaign,Generate calls from popup campaign daily 100 calls daily Popup microsoft crypto etc On salary project based or per call basis,"popup campaign generate, popup microsoft, salary project, calls, call basis"
Articles for Blog Post,We are looking for someone who can write articles for our blog posts,"blog post, articles"
Improve website traffic,"Please bid only if you are able to restore my traffic to 3000 per day and if you are bidding on this project i am assuming that you are able to do task and will award you without discussion and if and... (Budget: ₹1500 - ₹8000 INR, Jobs: Advertising, Internet Marketing, Link Building, Marketing, SEO)","internet marketing, link building, website traffic, budget, inr, jobs, advertising, seo, day, project"
3D unity game developer -- 9,Looking for unity game developer to do some tasks. Will share details in chat.,"unity game developer, tasks, details, chat"
Need ACF Custom Field Query Multiple Fields to Filter Posts,"I have 10 custom fields for my post, 9 are text based select fields and 1 which is price is numeric. Now I need to make filter from backend which will create new page based on my filtered post. I need WP Query which filter posts as per my selection, if “Any” from drop down selection is selected show all, and for numeric field which is price if price is added show less than entered price.","acf custom field query multiple fields, custom fields, select fields, filter posts, numeric field, price, new page, post, text, selection"
Blender expert for render shot,"I have FBX models, need to done texturing and make scene for render. BLender user only","fbx models, blender expert, blender user, render, scene"
Blog post articles,Looking for a content writer for our blog posts,"blog post articles, blog posts, content writer"
customize edit php script quickdate SMALL TIME FRAME,"Hello i have installed quickdate script but im looking for someone who will customize that for me i mean: -add polish language -change landing page -add two more gender: couple and trans -add new one info about sexuality: Hetero, Gej, Les, Bi -and some more information in profile (i will write everything, when we will make a deal) -create term, rules, privacy etc -add notice +18 Max 2 days is time frame","-add polish language -change landing page, edit php script quickdate, small time frame, trans -add, +18 max, -create term, hetero, gej, les, gender"
virtuemart shop,"virtuemart is already installed on joomla, I would like a total configuration don't offer me shopify and i don't want a newbie i want it done in 3 days","virtuemart shop virtuemart, total configuration, joomla, newbie, days"
Very Basic Website for Separated Catholics,"The purpose of this project is analyze if it's feasible (economically speaking), to create a space where true Catholic people can meet and creates friendship. We Catholics can't establish a relationship with nobody until you're divorce. But is not a sin to meet new people and creates friendship. Actually, if you're in that status, you need support from people with your faith. There's no online alternative for separated Catholics, you need to already divorce. You can create an account in catholicmatch website and other sites to see how they work. The website must have a paid subscription option to finance the operation.","true catholic people, separated catholics, basic website, new people, purpose, project, analyze, space, catholicmatch website, friendship"
"Solid works design, Bar Bending Machine","Hello, I am looking for someone who can design for me a simple Bar Bending Machine, The Machine should be driven By a mortar. Kindly Bid with samples of the Machine if you have already done it, Thank you.","bar bending machine hello, solid works design, machine, mortar, samples"
Golang project,.The main task is to design and implement programs that simulate the Game of Life on an image matrix,"golang project, image matrix, main task, game, life, programs"
looking for adword,looking for adword expert who can manage our account,"adword expert, account"
"Video Editor Like Wondershare Filmora, animoto or animaker","Hello i am looking for someone who can create a tool like wondershare filmora, animoto or animaker tool. any language in back-end will work. But i want PHP in front because i want to create versions and want it very flexible.","wondershare filmora, video editor, animoto, tool, animaker, php, language, versions, front"
Update My Registration Website to add cancellation,I have created a website using wordpress and php to implement registration. Need help on implementing retrieve registration and provide a cancellation option,"registration website, retrieve registration, cancellation option, wordpress, php, help"
Looking for developer who has rich experience with Plotly Dash,How are you? We need a dev who has rich experience with Plotly Dash,"plotly dash, rich experience, developer, dev"
Need to create PDF using speicifc Librabry,I am attaching my HTML code u need to use pdfrector () PHP or Javascript and create report like this. You can make trail and make it SamplePDF:,"speicifc librabry, pdf, php, javascript, html code u, pdfrector, report, samplepdf, trail"
I have a doc that has 139 text papers citations,I would like to convert doc that has 139 citations to endnote,"text papers citations, doc, citations"
Lead generation,"We are looking for a partner to generate b2c leads & appointments for Codingal with cold calling / outbound telemarketing campaigns. We work on a cost per lead (CPL) basis. The ownership, management, procurement of the data for the campaign will be taken care of by the partner. Codingal will not provide data for the campaign About Codingal Codingal is the world's leading platform and community for school students to learn Computer Science by building apps, games, and websites. Launched in September 2020; Codingal has empowered 350,000+ kids by motivating them to start learning to code. We are backed by leading investors like Y Combinator. Codingal is the fastest growing coding platform for K-12 (school kids). All classes are taught live 1:1 by vetted and trained teachers who ...","outbound telemarketing campaigns, b2c leads, lead generation, cold calling, codingal codingal, computer science, appointments, partner, school kids, school students"
urgent need wordpress and laravel developer,urgent need wordpress and laravel developer who can able to communicate fast via call or chat,"laravel developer, call"
Logo Design for The Wizardly Writer,"Copywriter and blog writer excentric but relaxed and fun ravens, witches, warlock hats fantasy but with a modern twist","wizardly writer copywriter, warlock hats fantasy, blog writer, logo design, fun ravens, modern twist, witches"
PowerApps Expert Required,Hi I need Microsoft PowerApps Expert for MIS work. The details of work will be shared to him subsequently.,"microsoft powerapps expert, mis work, details"
Improve website traffic,Please bid only if you are able to restore my traffic to 3000 per day and if you are bidding on this project i am assuming that you are able to do task and will award you without discussion and if and but since i don't know what actions you will perform to restore so don't tell me we will do this and this in this budget or what just i want results so be careful before bid. Website : Current Traffic :300 per Day Older traffic was. : 3000 per day Take your time to bid but bid only if you are sure Thanks,"website traffic, current traffic, older traffic, day, sure thanks, project, task, discussion, actions, budget"
Book cover for a novel,I have a novel that I have published I am not satisfied for the book cover I currently have would like to make it better,"book cover, novel"
windows desktop app development for posting ads,"you have skill for scraping, C or Java or python. automation posting program if you have interested project, please bid.","windows desktop app development, interested project, java, ads, skill, python, automation, program, c"
Unity 3D IK & FK  -- 2,"Hello there, It's just rigging what you have to do is to make a real time computer vision riging will show you the video","unity 3d ik, real time computer vision riging, video, fk"
Social Media Marketing for Mortgage Lead Generation,"Looking for someone who can help generate mortgage leads. I'd like a mix of resi, buy to let and bridging. To start with 25-50 leads as a test, going forwards a lot more","mortgage lead generation, social media marketing, mortgage leads, mix, test, forwards, lot"
Classified Ads Website for Australia,I am looking for a website to be built. A classified Ads Website With members login to site functionality. Pay per post functionality Bump Ads functionality,"classified ads website, post functionality bump ads, site functionality, australia, website, members"
Graphic designer needed -- 3,"Need a graphic designer who can build 4 graphics (banners) according to my description for the website. MUST START NOW (Budget: ₹600 - ₹1500 INR, Jobs: Banner Design, Graphic Design, Logo Design, Photoshop, Website Design)","graphic designer, website design, banner design, logo design, graphics, banners, description, budget, inr, jobs"
Python script -- 2,script for repeating task in browser,"python script, task, browser"
Wanted Virtual Assistant (Admin) in Tamilnadu.,Tamil/English language is must. Hindi is an added advantage. Nature of work: Organizing & Monitoring the work. This is a long term work. Only dedicated persons we need. Window Shoppers Please Excuse.,"wanted virtual assistant, english language, admin, tamilnadu, long term work, window shoppers, work, tamil, dedicated persons, hindi"
Real estate immersive visit,"We work in the residential real estate in belgium. We are also actif on Decentraland where we propose immersive visit. We are looking on the log term : Artist with Architecture Interior/Exterior Design Experience (3D app programming is a plus) Architecture Interior/Exterior 3D Design with Sktechup 3D Modeling and Rendering (Blender, Sketchup,Vray). Designs, conceptualizes and retouches 3D assets and materials for use in web-based, real-time applications, and photo realistic renderings; 3D modeling, UV Mapping / Unwrap, Texturing, 3D Rendering, Rigging, NFT, and Product Animation. Create engine-ready 3D models and textures for VR, AR, apps Ability to communicate design ideas and solutions clearly and effectively. Create the architectural and lighting elements Integrate the ...","residential real estate, exterior design experience, immersive visit, architecture interior, product animation, photo realistic renderings, design ideas, belgium, log term, real-time applications"
